[
  {
    "asset_id": "workflow-s08-callback-guardrail",
    "source_requirement_id": "req-s08-callback-guardrail",
    "catalog_entry_id": null,
    "name": "Synthetic Callback Guardrail Workflow",
    "asset_type": "workflow",
    "domain_scope": "domain_neutral",
    "business_domains": [],
    "owner": "Scenario Fixture Team",
    "reuse_status": "project_only",
    "capability_tags": [
      "before-tool",
      "guardrail",
      "audit"
    ],
    "binding": null,
    "connection": null,
    "workflow_profile": {
      "representation": "graph",
      "coordination": "explicit",
      "template_ref": null
    },
    "exposure": null,
    "confidence": 1,
    "rationale": "The reviewed flow owns callback evaluation, allow/block routing, pre-Tool short-circuit behavior, and redacted audit state for one synthetic operation.",
    "inputs": [
      {
        "name": "synthetic_operation_request",
        "type": "object",
        "required": true
      }
    ],
    "outputs": [
      {
        "name": "guarded_operation_outcome",
        "type": "object",
        "required": true
      }
    ],
    "risk_level": "medium",
    "risk_signals": [
      "audit_required"
    ],
    "status": "approved",
    "missing_information": []
  },
  {
    "asset_id": "tool-s08-synthetic-operation",
    "source_requirement_id": "req-s08-callback-guardrail",
    "catalog_entry_id": null,
    "name": "Synthetic Operation Tool",
    "asset_type": "tool",
    "domain_scope": "domain_neutral",
    "business_domains": [],
    "owner": "Scenario Fixture Team",
    "reuse_status": "project_only",
    "capability_tags": [
      "synthetic-operation",
      "guarded-invocation"
    ],
    "binding": {
      "kind": "function"
    },
    "connection": {
      "transport": "in_process"
    },
    "workflow_profile": null,
    "exposure": null,
    "confidence": 1,
    "rationale": "A dedicated no-side-effect Tool makes it observable whether the reviewed callback allowed or prevented invocation without introducing a real external effect.",
    "inputs": [
      {
        "name": "operation_id",
        "type": "string",
        "required": true
      }
    ],
    "outputs": [
      {
        "name": "executed",
        "type": "boolean",
        "required": true
      }
    ],
    "risk_level": "low",
    "risk_signals": [],
    "status": "approved",
    "missing_information": [],
    "side_effect": "none",
    "audit_required": false
  }
]
